{
  "policies": {
    "BlockAboutAddons": {
      "availability": { "mainstream": "60.0", "esr": "60.0" },
      "tags": ["block-access"],
      "schema": "boolean"
    },
    "BlockAboutConfig": {
      "availability": { "mainstream": "60.0", "esr": "60.0" },
      "tags": ["block-access"],
      "schema": "boolean"
    },
    "BlockAboutProfiles": {
      "availability": { "mainstream": "60.0", "esr": "60.0" },
      "tags": ["block-access"],
      "schema": "boolean"
    },
    "BlockAboutSupport": {
      "availability": { "mainstream": "60.0", "esr": "60.0" },
      "tags": ["block-access"],
      "schema": "boolean"
    },
    "AIControls": {
      "availability": { "mainstream": "149.0.2", "esr": "153.0" },
      "tags": ["features"],
      "exclude": ["GenerativeAI", "TranslateEnabled"],
      "schema": "object",
      "properties": [
        {
          "name": "Default",
          "label": "policy_description_AIControls_Default",
          "schema": "object",
          "lockable": true,
          "properties": [
            {
              "name": "Value",
              "schema": "enum",
              "preset": "ai_controls"
            }
          ]
        },
        {
          "name": "Translations",
          "label": "policy_description_AIControls_Translations",
          "schema": "object",
          "lockable": true,
          "properties": [
            {
              "name": "Value",
              "schema": "enum",
              "preset": "ai_controls"
            }
          ]
        },
        {
          "name": "PDFAltText",
          "label": "policy_description_AIControls_PDFAltText",
          "schema": "object",
          "lockable": true,
          "properties": [
            {
              "name": "Value",
              "schema": "enum",
              "preset": "ai_controls"
            }
          ]
        },
        {
          "name": "SmartTabGroups",
          "label": "policy_description_AIControls_SmartTabGroups",
          "schema": "object",
          "lockable": true,
          "properties": [
            {
              "name": "Value",
              "schema": "enum",
              "preset": "ai_controls"
            }
          ]
        },
        {
          "name": "LinkPreviewKeyPoints",
          "label": "policy_description_AIControls_LinkPreviewKeyPoints",
          "schema": "object",
          "lockable": true,
          "properties": [
            {
              "name": "Value",
              "schema": "enum",
              "preset": "ai_controls"
            }
          ]
        },
        {
          "name": "SidebarChatbot",
          "label": "policy_description_AIControls_SidebarChatbot",
          "schema": "object",
          "lockable": true,
          "properties": [
            {
              "name": "Value",
              "schema": "enum",
              "preset": "ai_controls"
            }
          ]
        },
        {
          "name": "SmartWindow",
          "label": "policy_description_AIControls_SmartWindow",
          "schema": "object",
          "lockable": true,
          "properties": [
            {
              "name": "Value",
              "schema": "enum",
              "preset": "ai_controls"
            }
          ]
        }
      ]
    },
    "GenerativeAI": {
      "availability": { "mainstream": "144.0", "esr": "140.4" },
      "tags": ["features"],
      "exclude": ["AIControls"],
      "deprecation": "policy_description_AIControls_deprecation",
      "schema": "object",
      "lockable": true,
      "properties": [
        {
          "name": "Enabled",
          "label": "policy_description_GenerativeAI_Enabled",
          "schema": "enum",
          "preset": "enable_optional"
        },
        {
          "name": "Chatbot",
          "label": "policy_description_GenerativeAI_Chatbot",
          "schema": "enum",
          "preset": "enable_optional"
        },
        {
          "name": "LinkPreviews",
          "label": "policy_description_GenerativeAI_LinkPreviews",
          "schema": "enum",
          "preset": "enable_optional"
        },
        {
          "name": "TabGroups",
          "label": "policy_description_GenerativeAI_TabGroups",
          "schema": "enum",
          "preset": "enable_optional"
        }
      ]
    },
    "TranslateEnabled": {
      "availability": { "mainstream": "126.0", "esr": "128.0" },
      "tags": ["features"],
      "exclude": ["AIControls"],
      "deprecation": "policy_description_AIControls_deprecation",
      "schema": "enum",
      "preset": "enable"
    },
    "VisualSearchEnabled": {
      "availability": { "mainstream": "144.0", "esr": "153.0" },
      "tags": ["features"],
      "schema": "enum",
      "preset": "enable"
    },
    "IPProtectionAvailable": {
      "availability": { "mainstream": "149.0.2", "esr": "153.0" },
      "tags": ["features"],
      "schema": "boolean",
      "inverse": true
    },
    "DisableFirefoxScreenshots": {
      "availability": { "mainstream": "60.0", "esr": "60.0" },
      "tags": ["features"],
      "schema": "boolean"
    },
    "DisableDeveloperTools": {
      "availability": { "mainstream": "60.0", "esr": "60.0" },
      "tags": ["features"],
      "schema": "boolean"
    },
    "DisableAccounts": {
      "availability": { "mainstream": "119.0", "esr": "128.0" },
      "tags": ["features"],
      "schema": "boolean"
    },
    "DisableSetDesktopBackground": {
      "availability": { "mainstream": "60.0", "esr": "60.0" },
      "tags": ["features"],
      "schema": "boolean"
    },
    "DisableProfileImport": {
      "availability": { "mainstream": "60.0", "esr": "60.0" },
      "tags": ["features"],
      "schema": "boolean"
    },
    "DisableSafeMode": {
      "availability": { "mainstream": "60.0", "esr": "60.0" },
      "tags": ["features"],
      "schema": "boolean"
    },
    "DisableFeedbackCommands": {
      "availability": { "mainstream": "60.0", "esr": "60.0" },
      "tags": ["features"],
      "schema": "boolean"
    },
    "DisableProfileRefresh": {
      "availability": { "mainstream": "60.0", "esr": "60.0" },
      "tags": ["features"],
      "schema": "boolean"
    },
    "UserMessaging": {
      "availability": { "mainstream": "75.0", "esr": "68.7" },
      "tags": ["features"],
      "schema": "object",
      "lockable": true,
      "properties": [
        {
          "name": "ExtensionRecommendations",
          "label": "policy_description_UserMessaging_ExtensionRecommendations",
          "schema": "enum",
          "preset": "boolean_optional"
        },
        {
          "name": "FeatureRecommendations",
          "label": "policy_description_UserMessaging_FeatureRecommendations",
          "schema": "enum",
          "preset": "boolean_optional"
        },
        {
          "name": "UrlbarInterventions",
          "label": "policy_description_UserMessaging_UrlbarInterventions",
          "schema": "enum",
          "preset": "boolean_optional"
        },
        {
          "name": "SkipOnboarding",
          "label": "policy_description_UserMessaging_SkipOnboarding",
          "schema": "enum",
          "preset": "boolean_optional"
        },
        {
          "name": "FirefoxLabs",
          "label": "policy_description_UserMessaging_FirefoxLabs",
          "schema": "enum",
          "preset": "boolean_optional"
        },
        {
          "name": "MoreFromMozilla",
          "label": "policy_description_UserMessaging_MoreFromMozilla",
          "schema": "enum",
          "preset": "boolean_optional"
        }
      ]
    },
    "AllowFileSelectionDialogs": {
      "availability": { "mainstream": "124.0", "esr": "128.0" },
      "tags": ["features"],
      "schema": "boolean",
      "inverse": true
    },
    "RequestedLocales": {
      "availability": { "mainstream": "64.0", "esr": "60.3.1" },
      "tags": ["customization"],
      "note": "policy_description_RequestedLocales_Requirement",
      "link": "https://addons.mozilla.org/firefox/language-tools/",
      "schema": "array",
      "items": {
        "schema": "string",
        "placeholder": "policy_description_RequestedLocales_Value",
        "allow_empty_value": true
      }
    },
    "DisplayMenuBar": {
      "availability": { "mainstream": "73.0", "esr": "68.5" },
      "tags": ["customization"],
      "note": "requirement_windows_or_linux",
      "schema": "enum",
      "options": [
        {
          "label": "policy_description_DisplayMenuBar_always",
          "value": "always"
        },
        {
          "label": "policy_description_DisplayMenuBar_never",
          "value": "never"
        },
        {
          "label": "policy_description_DisplayMenuBar_default_on",
          "value": "default-on"
        },
        {
          "label": "policy_description_DisplayMenuBar_default_off",
          "value": "default-off"
        }
      ]
    },
    "ShowHomeButton": {
      "availability": { "mainstream": "88.0", "esr": "78.10" },
      "tags": ["customization"],
      "schema": "enum",
      "preset": "boolean"
    },
    "Homepage": {
      "availability": { "mainstream": "60.0", "esr": "60.0" },
      "tags": ["customization"],
      "schema": "object",
      "lockable": true,
      "properties": [
        {
          "name": "StartPage",
          "label": "policy_description_Homepage_StartPage",
          "schema": "enum",
          "options": [
            {
              "label": "policy_description_Homepage_StartPage_Homepage",
              "value": "homepage"
            },
            {
              "label": "policy_description_Homepage_StartPage_Homepage_locked",
              "value": "homepage-locked"
            },
            {
              "label": "policy_description_Homepage_StartPage_None",
              "value": "none"
            },
            {
              "label": "policy_description_Homepage_StartPage_Previous_Session",
              "value": "previous-session"
            }